{
  "dataset": "data/evals/semantic-match/semantic-match-calibration-v2-canary.jsonl",
  "datasetVersion": "semantic-match-calibration-v2-canary",
  "mode": "live",
  "provider": "openai",
  "model": "deepseek-v4-flash",
  "qualityGateApplied": false,
  "humanReviewRequired": true,
  "metrics": {
    "total": 5,
    "passed": 5,
    "failed": 0,
    "succeeded": 5,
    "errors": 0,
    "verdictAccuracy": 1.0,
    "evidenceAccuracy": 1.0,
    "workflowSuccessRate": 1.0,
    "traceCoverage": 1.0,
    "providerExpectedCases": 5,
    "tracedProviderCases": 5
  },
  "confusionMatrix": {
    "matched": {"matched": 1, "partial": 0, "not_matched": 0, "error": 0},
    "partial": {"matched": 0, "partial": 3, "not_matched": 0, "error": 0},
    "not_matched": {"matched": 0, "partial": 0, "not_matched": 1, "error": 0}
  },
  "cases": [
    {
      "caseId": "v2-mcp-tooling-partial",
      "passed": true,
      "expectedEligibility": "blocked",
      "actualEligibility": "blocked",
      "expectedVerdict": "partial",
      "actualVerdict": "partial",
      "expectedEvidenceIds": ["ev_tools"],
      "actualEvidenceIds": ["ev_tools"],
      "actualReason": "Evidence explicitly demonstrates tool-calling and tool-integration capability, which is closely related to MCP protocol work but does not explicitly mention MCP.",
      "providerExpected": true,
      "traceRunId": "run_f546999f73914704a3d97f28fa6ac792",
      "error": null
    },
    {
      "caseId": "v2-fastapi-python-api-partial",
      "passed": true,
      "expectedEligibility": "conditional",
      "actualEligibility": "conditional",
      "expectedVerdict": "partial",
      "actualVerdict": "partial",
      "expectedEvidenceIds": ["ev_python_api"],
      "actualEvidenceIds": ["ev_python_api"],
      "actualReason": "Evidence demonstrates Python REST API implementation (routing, validation, testing), a transferable capability closely related to FastAPI, but does not explicitly prove FastAPI usage.",
      "providerExpected": true,
      "traceRunId": "run_0c4ecbe3916c4cae9bf22511dc8803d0",
      "error": null
    },
    {
      "caseId": "v2-langchain-agent-framework-partial",
      "passed": true,
      "expectedEligibility": "conditional",
      "actualEligibility": "conditional",
      "expectedVerdict": "partial",
      "actualVerdict": "partial",
      "expectedEvidenceIds": ["ev_agent_framework"],
      "actualEvidenceIds": ["ev_agent_framework"],
      "actualReason": "Evidence demonstrates transferable agent orchestration and tool-integration capability, but does not explicitly prove LangChain usage.",
      "providerExpected": true,
      "traceRunId": "run_c49098b88d2c42b79608a2507b6829d4",
      "error": null
    },
    {
      "caseId": "v2-mcp-react-ui-not-matched",
      "passed": true,
      "expectedEligibility": "blocked",
      "actualEligibility": "blocked",
      "expectedVerdict": "not_matched",
      "actualVerdict": "not_matched",
      "expectedEvidenceIds": [],
      "actualEvidenceIds": [],
      "actualReason": "使用 React 开发 AI 聊天界面，仅涉及界面交互与流式展示，未体现 MCP 协议或工具集成能力。",
      "providerExpected": true,
      "traceRunId": "run_73ce61e6496e485f9004c139986d2ece",
      "error": null
    },
    {
      "caseId": "v2-java-direct-matched",
      "passed": true,
      "expectedEligibility": "blocked",
      "actualEligibility": "blocked",
      "expectedVerdict": "matched",
      "actualVerdict": "matched",
      "expectedEvidenceIds": ["ev_java"],
      "actualEvidenceIds": ["ev_java"],
      "actualReason": "Evidence explicitly states using Java to develop an order service and handle production issue troubleshooting, demonstrating Java implementation experience.",
      "providerExpected": true,
      "traceRunId": "run_59a7a27b033140b9a0df1f61485b0072",
      "error": null
    }
  ],
  "traces": [
    {
      "runId": "run_f546999f73914704a3d97f28fa6ac792",
      "capability": "semantic_match",
      "version": "semantic-match-v1",
      "model": "deepseek-v4-flash",
      "promptVersion": "semantic-match-v2",
      "inputRefs": {"jobId":"job_v2-mcp-tooling-partial","profileId":"profile_v2-mcp-tooling-partial","profileVersion":1,"extractionId":"reqrun_v2-mcp-tooling-partial","requirementIds":["req_mcp_tooling"],"candidateEvidenceIds":["ev_tools"],"inputSha256":"314d75e0491f5ee4f637fb52425f969b2ef217b329d0044eefe8c92c25401208"},
      "output": {"assessments":[{"requirementId":"req_mcp_tooling","verdict":"partial","evidenceIds":["ev_tools"],"reason":"Evidence explicitly demonstrates tool-calling and tool-integration capability, which is closely related to MCP protocol work but does not explicitly mention MCP."}]},
      "latencyMs": 3648,
      "inputTokens": 595,
      "outputTokens": 66,
      "error": null
    },
    {
      "runId": "run_0c4ecbe3916c4cae9bf22511dc8803d0",
      "capability": "semantic_match",
      "version": "semantic-match-v1",
      "model": "deepseek-v4-flash",
      "promptVersion": "semantic-match-v2",
      "inputRefs": {"jobId":"job_v2-fastapi-python-api-partial","profileId":"profile_v2-fastapi-python-api-partial","profileVersion":1,"extractionId":"reqrun_v2-fastapi-python-api-partial","requirementIds":["req_fastapi_related"],"candidateEvidenceIds":["ev_python_api"],"inputSha256":"1e55345e6c56e4f1b03f62aebb7cb80de641222de1041be2e6409ddc4bea3c8e"},
      "output": {"assessments":[{"requirementId":"req_fastapi_related","verdict":"partial","evidenceIds":["ev_python_api"],"reason":"Evidence demonstrates Python REST API implementation (routing, validation, testing), a transferable capability closely related to FastAPI, but does not explicitly prove FastAPI usage."}]},
      "latencyMs": 2932,
      "inputTokens": 606,
      "outputTokens": 70,
      "error": null
    },
    {
      "runId": "run_c49098b88d2c42b79608a2507b6829d4",
      "capability": "semantic_match",
      "version": "semantic-match-v1",
      "model": "deepseek-v4-flash",
      "promptVersion": "semantic-match-v2",
      "inputRefs": {"jobId":"job_v2-langchain-agent-framework-partial","profileId":"profile_v2-langchain-agent-framework-partial","profileVersion":1,"extractionId":"reqrun_v2-langchain-agent-framework-partial","requirementIds":["req_langchain_related"],"candidateEvidenceIds":["ev_agent_framework"],"inputSha256":"c3ce417bb8f8e1763219da14da382b3377b8abd4dbf63ff0d3d82e05604e656a"},
      "output": {"assessments":[{"requirementId":"req_langchain_related","verdict":"partial","evidenceIds":["ev_agent_framework"],"reason":"Evidence demonstrates transferable agent orchestration and tool-integration capability, but does not explicitly prove LangChain usage."}]},
      "latencyMs": 3850,
      "inputTokens": 605,
      "outputTokens": 76,
      "error": null
    },
    {
      "runId": "run_73ce61e6496e485f9004c139986d2ece",
      "capability": "semantic_match",
      "version": "semantic-match-v1",
      "model": "deepseek-v4-flash",
      "promptVersion": "semantic-match-v2",
      "inputRefs": {"jobId":"job_v2-mcp-react-ui-not-matched","profileId":"profile_v2-mcp-react-ui-not-matched","profileVersion":1,"extractionId":"reqrun_v2-mcp-react-ui-not-matched","requirementIds":["req_mcp_ui"],"candidateEvidenceIds":["ev_ai_ui"],"inputSha256":"6fb01b00edb4781056a2896d23146e2779429ff95d4f4284a8b719412bbba2bd"},
      "output": {"assessments":[{"requirementId":"req_mcp_ui","verdict":"not_matched","evidenceIds":[],"reason":"使用 React 开发 AI 聊天界面，仅涉及界面交互与流式展示，未体现 MCP 协议或工具集成能力。"}]},
      "latencyMs": 2611,
      "inputTokens": 606,
      "outputTokens": 80,
      "error": null
    },
    {
      "runId": "run_59a7a27b033140b9a0df1f61485b0072",
      "capability": "semantic_match",
      "version": "semantic-match-v1",
      "model": "deepseek-v4-flash",
      "promptVersion": "semantic-match-v2",
      "inputRefs": {"jobId":"job_v2-java-direct-matched","profileId":"profile_v2-java-direct-matched","profileVersion":1,"extractionId":"reqrun_v2-java-direct-matched","requirementIds":["req_java_direct"],"candidateEvidenceIds":["ev_java"],"inputSha256":"64b0d72a64cd10b439dcc85de5365429fb3e7f2113b61b316bd051b84e070bb2"},
      "output": {"assessments":[{"requirementId":"req_java_direct","verdict":"matched","evidenceIds":["ev_java"],"reason":"Evidence explicitly states using Java to develop an order service and handle production issue troubleshooting, demonstrating Java implementation experience."}]},
      "latencyMs": 5491,
      "inputTokens": 590,
      "outputTokens": 56,
      "error": null
    }
  ]
}
